{
  "schema_version": 2,
  "requirement_ref": "docs/requirements/demo/STATE.md",
  "slice_id": "S01",
  "assignment_id": "assignment-S01",
  "attempt_id": "attempt-1",
  "attempt_number": 1,
  "plan_version": "v1",
  "authorization_ref": {
    "path": "docs/requirements/demo/AUTHORIZATION.md",
    "sha256": "c68db555da3832363f2322e8f6ae80d1a3bdce6df30900bf37ac088c7703fdef"
  },
  "coordinator_id": "fixture-coordinator",
  "handoff_ref": null,
  "brief_ref": {
    "path": "docs/requirements/demo/slices/S01/EXECUTION_BRIEF.md",
    "sha256": "5b3864e7888baddd7e873fbb937fe391eb7377d81722b64c4e50945476db9b0d"
  },
  "base_refs": [
    {
      "path": "src/example.txt",
      "sha256": "62f4b5ece858a8e4da55a9d0b7166c48cf834f9c965d0c18baee60047b9d499b"
    }
  ],
  "context_refs": [
    {
      "path": "docs/requirements/demo/CRITERIA.md",
      "sha256": "f99afff92b84f0686336ce83dbcd890f3655db77c57b2561553529a852ace107"
    }
  ],
  "instruction_refs": [
    {
      "path": "AGENTS.md",
      "sha256": "f67f6ba6da52e9a6b61d6fce132559de6543fe5cf1e5341fa43257e56363582c"
    }
  ],
  "factory_version": "2.2.2",
  "objective": "Explain input without writing files.",
  "criteria_refs": [
    {
      "path": "docs/requirements/demo/CRITERIA.md",
      "sha256": "f99afff92b84f0686336ce83dbcd890f3655db77c57b2561553529a852ace107"
    }
  ],
  "read_scope": [
    "src/example.txt",
    "docs/requirements/demo/CRITERIA.md",
    "AGENTS.md"
  ],
  "proposal_scope": [
    "src/example.txt"
  ],
  "project_write_scope": [],
  "dependencies": [],
  "max_attempts": 2,
  "no_recursion": true,
  "review_at": "2099-09-20T12:00:00Z",
  "runtime": {
    "client": "offline-fixture",
    "version": "synthetic",
    "capability_ref": {
      "path": "docs/requirements/demo/slices/S01/runtime.txt",
      "sha256": "3f3e6435772dabe3a2f38337019ea49bc62d7ac39b3dc21659bb945dbb8d4a2e"
    },
    "thread_id": "fixture-thread-1",
    "observation": "known",
    "observed_at": "2026-09-20T12:05:00Z",
    "stop_confirmed": true,
    "stop_evidence_ref": {
      "path": "docs/requirements/demo/slices/S01/runtime.txt",
      "sha256": "3f3e6435772dabe3a2f38337019ea49bc62d7ac39b3dc21659bb945dbb8d4a2e"
    }
  },
  "requested_profile": "BALANCED",
  "resolved_config": null,
  "observed_config": null,
  "model_evidence_ref": null,
  "status": "accepted",
  "reason": "SYNTHETIC fixture, not runtime evidence.",
  "history": [
    {
      "status": "prepared",
      "at": "2026-09-20T12:00:00Z",
      "evidence_ref": null
    },
    {
      "status": "running",
      "at": "2026-09-20T12:01:00Z",
      "evidence_ref": {
        "path": "docs/requirements/demo/slices/S01/runtime.txt",
        "sha256": "3f3e6435772dabe3a2f38337019ea49bc62d7ac39b3dc21659bb945dbb8d4a2e"
      }
    },
    {
      "status": "submitted",
      "at": "2026-09-20T12:02:00Z",
      "evidence_ref": {
        "path": "docs/requirements/demo/slices/S01/runtime.txt",
        "sha256": "3f3e6435772dabe3a2f38337019ea49bc62d7ac39b3dc21659bb945dbb8d4a2e"
      }
    },
    {
      "status": "accepted",
      "at": "2026-09-20T12:03:00Z",
      "evidence_ref": {
        "path": "docs/requirements/demo/slices/S01/runtime.txt",
        "sha256": "3f3e6435772dabe3a2f38337019ea49bc62d7ac39b3dc21659bb945dbb8d4a2e"
      }
    }
  ],
  "delivery_ref": {
    "path": "docs/requirements/demo/slices/S01/attempt-1-delivery.json",
    "sha256": "9650efca39dd5a183c8e0e3f18986ecb146e1977da1a5f232c45bebc84075b71"
  },
  "validation_refs": [
    {
      "path": "docs/requirements/demo/slices/S01/validation.txt",
      "sha256": "3e1c0f25c5fafb07bff8251fc464e1f118e9f5a60e2fc37fddcb5db9b39bd6d8"
    }
  ],
  "integration_ref": {
    "path": "docs/requirements/demo/slices/S01/integration.txt",
    "sha256": "c9950e81cabc6bf5056fb5bf942055d6f859ba8e507e3b67ec6742af9bc26362"
  },
  "acceptance_ref": {
    "path": "docs/requirements/demo/slices/S01/acceptance.txt",
    "sha256": "e206be8ae40f9ba56122aa345d737f72c6639492d5b829c8c3e224136e5d434c"
  },
  "supervision": {
    "policy": "supervised-audited-v1",
    "risk_acceptance_ref": {
      "path": "docs/requirements/demo/AUTHORIZATION.md",
      "sha256": "c68db555da3832363f2322e8f6ae80d1a3bdce6df30900bf37ac088c7703fdef"
    },
    "context_review_ref": {
      "path": "docs/requirements/demo/slices/S01/runtime.txt",
      "sha256": "3f3e6435772dabe3a2f38337019ea49bc62d7ac39b3dc21659bb945dbb8d4a2e"
    },
    "controls": {
      "original_protection": {
        "requested": true,
        "mechanism": "runtime",
        "observed": "unknown",
        "evidence_ref": null
      },
      "external_mutations": {
        "requested": true,
        "mechanism": "runtime",
        "observed": "unknown",
        "evidence_ref": null
      },
      "no_recursion": {
        "requested": true,
        "mechanism": "runtime",
        "observed": "unknown",
        "evidence_ref": null
      },
      "observation_and_stop": {
        "requested": true,
        "mechanism": "runtime",
        "observed": "unknown",
        "evidence_ref": null
      },
      "no_copy_writes": {
        "requested": true,
        "mechanism": "instruction",
        "observed": "satisfied",
        "evidence_ref": {
          "path": "docs/requirements/demo/slices/S01/runtime.txt",
          "sha256": "3f3e6435772dabe3a2f38337019ea49bc62d7ac39b3dc21659bb945dbb8d4a2e"
        }
      }
    },
    "incident_refs": [],
    "copy_before_ref": {
      "path": "docs/requirements/demo/slices/S01/attempt-1-copy-before.json",
      "sha256": "0222a84b67c6cb6c10eaff564c2528f475c516300c9d4dcde30324cfceccdd3f"
    },
    "copy_after_ref": {
      "path": "docs/requirements/demo/slices/S01/attempt-1-copy-after.json",
      "sha256": "0222a84b67c6cb6c10eaff564c2528f475c516300c9d4dcde30324cfceccdd3f"
    },
    "copy_audit_ref": {
      "path": "docs/requirements/demo/slices/S01/attempt-1-copy-audit.json",
      "sha256": "879c6a2d47a3bcc5580624819dbe1ffd5dc98e0cf38003831d3e4020c479feba"
    },
    "original_before_ref": {
      "path": "docs/requirements/demo/slices/S01/attempt-1-original-before.json",
      "sha256": "7f7c6b6eb9e8107360533cfc48859b008f575c64dc2cc19eed35e9887ca35287"
    },
    "original_after_ref": {
      "path": "docs/requirements/demo/slices/S01/attempt-1-original-after.json",
      "sha256": "7f7c6b6eb9e8107360533cfc48859b008f575c64dc2cc19eed35e9887ca35287"
    },
    "original_audit_ref": {
      "path": "docs/requirements/demo/slices/S01/attempt-1-original-audit.json",
      "sha256": "d7dc8148d1c34efe7e657ffef1767aaa4be5b8c741f274fa24a595230c25dfb0"
    }
  }
}
